{
  "$schema": "https://json-schema.org/draft/2020-12/schema",
  "title": "Fideon canonical schema - _fallback (policy_check)",
  "description": "Generated by tools/build_fallback_schema.py from common_model.json 1.1.0 (SPEC_00 amendment of 5 October 2026, item 1). Never edit by hand: regenerate with every common-model release. Exactly the SPEC_21 section 4.2.1 envelope; values that would go in a unit block or a LOB block are written to additional_fields with a section_hint.",
  "fideon:doc_type": "policy_check",
  "fideon:lob": "_fallback",
  "fideon:is_fallback": true,
  "fideon:schema_version": "1.1.0",
  "fideon:common_model_version": "1.1.0",
  "fideon:mandatory_fields": [
    "carrier.name",
    "named_insured.primary_name",
    "policy.policy_number",
    "policy.effective_date",
    "policy.expiration_date"
  ],
  "type": "object",
  "additionalProperties": false,
  "required": [
    "carrier",
    "named_insured",
    "policy"
  ],
  "properties": {
    "document": {
      "$ref": "../common/common_model.json#/$defs/document"
    },
    "carrier": {
      "$ref": "../common/common_model.json#/$defs/carrier"
    },
    "producer": {
      "$ref": "../common/common_model.json#/$defs/producer"
    },
    "named_insured": {
      "$ref": "../common/common_model.json#/$defs/named_insured"
    },
    "policy": {
      "$ref": "../common/common_model.json#/$defs/policy"
    },
    "lob_parts": {
      "$ref": "../common/common_model.json#/$defs/lob_parts"
    },
    "coverages": {
      "$ref": "../common/common_model.json#/$defs/coverages"
    },
    "deductibles": {
      "$ref": "../common/common_model.json#/$defs/deductibles"
    },
    "interested_parties": {
      "$ref": "../common/common_model.json#/$defs/interested_parties"
    },
    "premium": {
      "$ref": "../common/common_model.json#/$defs/premium"
    },
    "billing": {
      "$ref": "../common/common_model.json#/$defs/billing"
    },
    "forms_and_endorsements": {
      "$ref": "../common/common_model.json#/$defs/forms_and_endorsements"
    },
    "additional_fields": {
      "$ref": "../common/common_model.json#/$defs/additional_fields"
    },
    "text_sections": {
      "$ref": "../common/common_model.json#/$defs/text_sections"
    }
  }
}