{
  "carrier": {},
  "producer": {
    "agency_name": {
      "raw": "Hanover Risk Partners",
      "parsed": "Hanover Risk Partners",
      "confidence": {
        "score": 1.0,
        "source": "audit"
      },
      "page_ref": [
        1
      ],
      "flagged": false
    }
  },
  "policy": {
    "policy_number": {
      "raw": "WC-8842317-01",
      "parsed": "WC-8842317-01",
      "confidence": {
        "score": 1.0,
        "source": "audit"
      },
      "page_ref": [
        1
      ],
      "flagged": false
    },
    "effective_date": {
      "raw": "04/01/2026",
      "parsed": "2026-04-01",
      "confidence": {
        "score": 1.0,
        "source": "audit"
      },
      "page_ref": [
        1
      ],
      "flagged": false
    },
    "expiration_date": {
      "raw": "04/01/2027",
      "parsed": "2027-04-01",
      "confidence": {
        "score": 1.0,
        "source": "audit"
      },
      "page_ref": [
        1
      ],
      "flagged": false
    }
  },
  "named_insured": {
    "primary_name": {
      "raw": "Rivera Fabrication LLC",
      "parsed": "Rivera Fabrication LLC",
      "confidence": {
        "score": 1.0,
        "source": "audit"
      },
      "page_ref": [
        1
      ],
      "flagged": false
    },
    "mailing_address": {
      "line_1": {
        "raw": "1420 Foundry Road",
        "parsed": "1420 Foundry Road",
        "confidence": {
          "score": 1.0,
          "source": "audit"
        },
        "page_ref": [
          1
        ],
        "flagged": false
      },
      "city": {
        "raw": "Toledo",
        "parsed": "Toledo",
        "confidence": {
          "score": 1.0,
          "source": "audit"
        },
        "page_ref": [
          1
        ],
        "flagged": false
      },
      "state": {
        "raw": "OH",
        "parsed": "OH",
        "confidence": {
          "score": 1.0,
          "source": "audit"
        },
        "page_ref": [
          1
        ],
        "flagged": false
      },
      "postal_code": {
        "raw": "43604",
        "parsed": "43604",
        "confidence": {
          "score": 1.0,
          "source": "audit"
        },
        "page_ref": [
          1
        ],
        "flagged": false
      }
    }
  },
  "premium": {
    "total_policy_premium": {
      "raw": "$47,250.00",
      "parsed": 47250.0,
      "confidence": {
        "score": 1.0,
        "source": "audit"
      },
      "page_ref": [
        1
      ],
      "flagged": false
    }
  }
}
